{
  "resolution": "1080x1920",
  "fps": 30,
  "ken_burns": {
    "zoom_factor": 1.15,
    "motion": "zoom-in"
  },
  "transition": {
    "type": "cut",
    "duration_ms": 0
  },
  "caption": {
    "burn_in": true,
    "font": "Pretendard",
    "font_size": 56,
    "outline": 2
  },
  "safe_area": {
    "enabled": false,
    "scale_pct": 85,
    "margin_color": "black"
  },
  "first_scene": {
    "impact_enabled": false,
    "duration_sec": 1.5,
    "zoom_start": 0.92,
    "zoom_end": 1.05
  },
  "bgm": {
    "enabled": false
  },
  "timeout_sec": 120
}
